{
  "schema": "eip-8304-fixture",
  "schema_version": 1,
  "status": "draft-pre-root",
  "eip_revision": "81b976ac01591fed2eecb73fa574f27cd18db2e8",
  "name": "multi-transaction-multi-log-all-topic-positions",
  "input": {
    "block_number": "0x2a",
    "parent_block_hash": "0x978ce0036b6d1c62d716045505587d15cc85a1def92f9f450937b6467295e517",
    "transactions": [
      { "hash": "0x1111111111111111111111111111111111111111111111111111111111111111" },
      { "hash": "0x2222222222222222222222222222222222222222222222222222222222222222" }
    ],
    "receipts": [
      {
        "logs": [
          {
            "address": "0xaaaaaaaaaaaaaaaaaaaaaaaaaaaaaaaaaaaaaaaa",
            "topics": [
              "0x0101010101010101010101010101010101010101010101010101010101010101",
              "0x0202020202020202020202020202020202020202020202020202020202020202",
              "0x0303030303030303030303030303030303030303030303030303030303030303",
              "0x0404040404040404040404040404040404040404040404040404040404040404"
            ]
          },
          {
            "address": "0xbbbbbbbbbbbbbbbbbbbbbbbbbbbbbbbbbbbbbbbb",
            "topics": [
              "0x0101010101010101010101010101010101010101010101010101010101010101",
              "0x0505050505050505050505050505050505050505050505050505050505050505"
            ]
          }
        ]
      },
      {
        "logs": [
          {
            "address": "0xaaaaaaaaaaaaaaaaaaaaaaaaaaaaaaaaaaaaaaaa",
            "topics": [
              "0x0606060606060606060606060606060606060606060606060606060606060606"
            ]
          }
        ]
      }
    ]
  },
  "expected": {
    "encoded_entries_chronological": [
      "0x0000978ce0036b6d1c62d716045505587d15cc85a1def92f9f450937b6467295e5170000000000000029",
      "0x00011111111111111111111111111111111111111111111111111111111111111111000000000000002a0000000000000000",
      "0x0002aaaaaaaaaaaaaaaaaaaaaaaaaaaaaaaaaaaaaaaa000000000000002a0000000000000000",
      "0x00030101010101010101010101010101010101010101010101010101010101010101000000000000002a0000000000000000",
      "0x00040202020202020202020202020202020202020202020202020202020202020202000000000000002a0000000000000000",
      "0x00050303030303030303030303030303030303030303030303030303030303030303000000000000002a0000000000000000",
      "0x00060404040404040404040404040404040404040404040404040404040404040404000000000000002a0000000000000000",
      "0x0002bbbbbbbbbbbbbbbbbbbbbbbbbbbbbbbbbbbbbbbb000000000000002a0000000000000001",
      "0x00030101010101010101010101010101010101010101010101010101010101010101000000000000002a0000000000000001",
      "0x00040505050505050505050505050505050505050505050505050505050505050505000000000000002a0000000000000001",
      "0x00012222222222222222222222222222222222222222222222222222222222222222000000000000002a0000000100000002",
      "0x0002aaaaaaaaaaaaaaaaaaaaaaaaaaaaaaaaaaaaaaaa000000000000002a0000000100000000",
      "0x00030606060606060606060606060606060606060606060606060606060606060606000000000000002a0000000100000000"
    ],
    "encoded_entries_sorted": [
      "0x0000978ce0036b6d1c62d716045505587d15cc85a1def92f9f450937b6467295e5170000000000000029",
      "0x00011111111111111111111111111111111111111111111111111111111111111111000000000000002a0000000000000000",
      "0x00012222222222222222222222222222222222222222222222222222222222222222000000000000002a0000000100000002",
      "0x0002aaaaaaaaaaaaaaaaaaaaaaaaaaaaaaaaaaaaaaaa000000000000002a0000000000000000",
      "0x0002aaaaaaaaaaaaaaaaaaaaaaaaaaaaaaaaaaaaaaaa000000000000002a0000000100000000",
      "0x0002bbbbbbbbbbbbbbbbbbbbbbbbbbbbbbbbbbbbbbbb000000000000002a0000000000000001",
      "0x00030101010101010101010101010101010101010101010101010101010101010101000000000000002a0000000000000000",
      "0x00030101010101010101010101010101010101010101010101010101010101010101000000000000002a0000000000000001",
      "0x00030606060606060606060606060606060606060606060606060606060606060606000000000000002a0000000100000000",
      "0x00040202020202020202020202020202020202020202020202020202020202020202000000000000002a0000000000000000",
      "0x00040505050505050505050505050505050505050505050505050505050505050505000000000000002a0000000000000001",
      "0x00050303030303030303030303030303030303030303030303030303030303030303000000000000002a0000000000000000",
      "0x00060404040404040404040404040404040404040404040404040404040404040404000000000000002a0000000000000000"
    ],
    "leaf_hashes_sorted": [
      "0x6c37cfbb46626073de276c26c2897f4dd4ef656232aa0b2579455b082263aa3a",
      "0x9aea4893ac192c96dc27adeb8f2caeeb5663d5afc491c954f10534f628064872",
      "0x06f30070b196ccf8393f6ef00582f3a5bd35e581ca160a81f120773274c96b53",
      "0x927a0247b5cc600e475c867719909b2291df1c84329ebce2dcb167ff647b7d8a",
      "0x6dffdb8fc1e01d8fdedba7acf3c978e87654a997459dceb689f57ff381f902d6",
      "0x80eaed31413688c78aa6ec9eea19b32925cb8f7bd9e23e1b422fac94b221b6d0",
      "0x7994fc403bf38f70928c2cc213d88f97ab918c4d2ebce339349fa176acecad3a",
      "0xbf5da964be53cc15d6d3ac0625cf88adabffbf953cb477d899b85c4b3d0dae38",
      "0x4181dbea7934544603a51ddb6523d7d552e70d217c04ff05bc0380b925bf5f08",
      "0xe938aa30365c75be7077e3989bc91d8dce6fac6cc7db9a0a532ec19992b56e41",
      "0x2103693d6d119013ce5c0f42f5cee608fe7f26b194e55bec32c3c0e3dd2d351c",
      "0xf3576586bd22133fc5242ff985e9f286bc9985f0b5498cb1662304e65e987360",
      "0xd8a2d3b18d6679ccbc61085327b8c27506a7ab2a7b2098d21444b661564326c6"
    ],
    "entry_count": "0xd"
  }
}
